passage	question	qus_type	answer
咋防重庆公交惨剧再发生？媒体:司机乘客隔开足以原标题：如何防止重庆公交坠江惨剧再次发生？重庆万州“10·28”公交车坠江事故引起社会巨大关注。人命关天，公交失控，冲破护栏坠入江中，一下子十几条人命就没了。人皆有怜悯之心，此等惨剧，怎能不让人唏嘘不已？但从“新闻”传播角度看，这场车祸之所以成为“热点”，更重要的则是导致车祸发生的奇葩原因，以及由其引发的各种争论。死者已矣，人死不能复生；对于社会而言，最紧要的问题是如何防止诸如此类的悲剧再次发生。10月31日23时30分左右，重庆万州坠江的公交车被打捞出水面。根据公交“黑匣子”所提供的影像资料，人们得以了解公交失控坠江酿成惨剧的全过程。起因是一位刘姓女子坐过站，希望公交停车而被司机拒绝，然后这位女子就开始上前谩骂并攻击公交司机。司机也不甘示弱，一边开车，一边频频回头对女子予以还击。突然间，司机一转头，似乎觉得出了什么问题，开始猛地向左打方向盘，结果导致公交车全然失控，最后影像在尖叫声、惊呼声和剧烈碰撞声中戛然而止。如同一千个人有一千个哈姆雷特，同样一段影像，不同的人从中读出了不同的感受，以及不同的解决方案。但必须说，既有的各种方案大都不靠谱。有人从中读出了社会风气的“暴戾”。这位刘姓“泼妇”，仅仅因为公交坐过了一站，就如此撒泼，对于正在开车的司机大打出手。而这位司机也不是善茬，缺乏基本的职业精神，明知道公交高速行驶，面对泼妇的谩骂和攻击，就不能“忍一忍”，至少也应该刹车减速才对。持有这种看法的人，认为避免此类问题再次发生，需要提高国民素质以及司机的专业技能。但很显然，提高国民素质基本上是“远水解不了近渴”，而提高司机的专业技能也很难相信能够防止“冲动是魔鬼”。有人从中读出了怒其不争的“活该”。在他们看来，看到刘姓泼妇攻击司机的危险行为，车上的乘客应该挺身而出，“正当防卫”，帮助司机制服泼妇；但在整个过程中，车上的人居然都抱着“事不关己，高高挂起”的看客心态，最终酿成大祸，一车人全部命丧黄泉，注解了鲁迅先生“哀其不幸，怒其不争”的论断。网上流传的另一段视频，似乎对这种观点提供了强力支持。类似的情况，也是公交车上有位中年男子坐过站，要求临时停车遭到司机拒绝，于是开始攻击司机并抢夺方向盘。就在这时，一位青年男子挺身而出，突然一个飞腿将肇事者制服，避免了悲剧发生。对比两个案例，类似的情形，不同的结果，的确说明“乘客行动主义”的重要性。但必须承认，“乘客行动主义”的解决方案，能否次次奏效，却是全然没有保障的。没有人能保证，每辆公交车上都有一个身手敏捷、时刻警觉的青年男子。更重要的是，即便有类似的青年男子坐在车上，他也不一定敢于“该出手时就出手”。设想一下，假如青年男子飞腿过去，的确是避免了车祸发生，但那位本来抢夺司机方向盘的“坏人”却被踹伤踹死了，青年男子是否可以凭借“正当防卫”的理由而平安无事？我猜测，大概率事件是这名青年男子即便不坐牢，也必须出一大笔钱破财消灾。“乘客行动主义”方案面临的基本困境是，挺身而出的见义勇为者，是在为整车人的安全提供“公共品”，好处大家均沾，但成本却由他自己个人承担。最终的结果，“乘客行动主义”要么沦为键盘侠们想象中的完美方案，要么让见义勇为者陷于舍己救人的尴尬境地。有人从中读出了法律责任的重要性。惨剧发生之后，不少法学家开始讨论事故背后的责任界定以及法律赔偿问题，认为严厉处罚的威慑效应，有助于避免类似的情况再次发生。罪与罚的清晰界定，对于建立良好的、正常的社会秩序当然至关重要，但必须指出，这对于避免如此之类的问题却作用不大，甚至于无能为力。为什么？罪与罚的威慑效应要起作用，必须有个基本前提，即人们必须能够理性预期到其所作所为可能导致的法律后果。但很显然，冲动是魔鬼，对于“垃圾人”，或者“间歇性神经病”，这个基本前提并不成立。有破有立，光否定是不够的，还必须提出建设性的解决方案。在我看来，为了防止诸如此类的悲剧再次发生，看起来似乎最无奈但实际上也可能最好的办法，就是对公共交通工具进行设计改造，将司机与乘客进行有效隔离，防止极少数失去理智的乘客干扰司机的正常工作。这个建议，既不是什么创举，也不是异想天开，而是已经在飞机、高铁乃至于出租车上广泛使用的。现在所需要做的，就是将类似的做法推广到长途大巴、公共汽车等其他公共交通工具上而已。任何制度的改革，都需要评估其潜在的收益和成本。对公共交通车辆的司机和乘客予以隔离，必然要求对既有车辆进行改造，也可能会对售票方式提出新的挑战。但两害相权取其轻，面对乘客的生命和财产安全，这些改造成本应该是值得的。进一步，广大乘客乘车出行，就是为了出行而已，并不是要练好跆拳道，时刻警惕着，随时挺身而出，帮助司机制服那些可能会对行车安全造成威胁的无理乘客。更进一步，这也极大地降低公共交通的行车安全中对于见义勇为者的呼唤。圣人不死，大盗不止。平凡人只需要一个平凡安静的生活。为了防止重庆万州公交坠江惨剧的发生，不需要乘客的见义勇为式的“正当防卫”，只需要将司机和乘客进行有效隔离就足够了。（作者寇宗来为复旦大学经济学院教授）点击进入专题：重庆公交坠江事件责任编辑：余鹏飞	刘姓泼妇为什么不道德？	32	女子在司机驾车期间，谩骂攻击司机
敬业奉献2016年4月杨增叶执教的高圪垯村位于横山县南部山区，距离最近的乡镇也有10多公里，非常偏远贫困。为了过上好生活，村里大多数青壮年都外出打工，这个曾有860人的村子，如今只剩下300多人，且多是老弱病残。村里的高圪垯村小学如今只有9个孩子，都来自贫困家庭。9个孩子中，有3个孩子没有了妈妈，其余的或是父母病残，或是父母不在身边、由年迈的爷爷奶奶照看的留守儿童。村里的老人说，如果没有杨增叶老师，那几个缺爹少妈的娃娃肯定上不了学。在高圪垯村小学仅有的一间开课的教室里，5张桌子分成3列，9个孩子分为3个年级。孩子们每天的早饭和午饭都要在学校吃，学校唯一的教师杨增叶同时也是孩子们的厨师，几个没妈的孩子连梳洗打扮都要靠杨老师。2005年因撤点并校，原本130多人的学校面临关闭，在学生家长的请求下，为了不让一些因特殊条件无法去镇上上学的孩子们辍学，杨增叶在其他老师离开后，开始了长达10余年的独自教学。作为民办教师，杨增叶全年的收入只有1万多元。因丈夫常年不在家，两个儿子又在外工作，家里的20多亩地全靠杨增叶一人打理。提起这些年一路走来的艰辛，杨老师说太难了，心里的苦，身体的病痛……2005年大雪天，杨老师步行去20里外的乡政府送学籍资料，路上摔断了胳膊。但她吊着胳膊还要上课，放学了还要到地里干农活。她还患有腰椎间盘突出，腰腿疼的时候，一步都挪不动。杨老师说，没想过放弃那是假的。但每到开学时，家长就会上门催问什么时候开学，如果自己不教，这些孩子该怎么办？杨老师的事迹先后被榆林日报、榆林电视台、新华社、中国青年报、陕西党建网等各主流媒体报道。2013年杨老师被青少年基金会授予“TCL希望工程烛光奖”。2015年5月应邀参加央视《乡村大世界》节目录制。（陕西省文明办供稿）◎杨增叶杨增叶，1965年生，陕西省榆林市横山县人。从1996年站上教师讲台开始，她默默坚守在黄土高原深处的乡村小学长达20年。致敬词乡村女教师坚守黄土高原上的乡村小学长达20载，耕耘着山村教育的一片热土，她是杨老师，更是杨妈妈。	谁坚守乡村小学20年	21	杨增叶
2016年5月孝老爱亲◎郑玉凡郑玉凡，1969年生，辽宁省盘锦市盘山县人。丈夫意外离世，她只手撑起一个家，15年无怨无悔悉心照料公婆。致敬词郑玉凡用15年的坚忍和执着，延续着亲情大爱，用柔弱的肩膀为公婆和孩子撑起一片爱的天空，用实际行动生动地诠释了“百善孝为先”的中华美德。2001年，郑玉凡的丈夫在一次车祸中不幸离世。当时年仅32岁的郑玉凡面对年迈的公婆和两个幼女，毅然选择留在丈夫家，照顾年幼的孩子，慰藉伤心欲绝的公婆。公婆身体都不好，从家里的活到地里的活都得靠郑玉凡一个人。然而，她在家人面前从未有过一句怨言，每当撑不下去时，她就独自躲在角落里哭，第二天又打起精神投入到一天的劳作中。婆婆待郑玉凡就像自己的亲闺女一样，看她为这个家辛苦付出，十分心疼，曾几次劝说她重新寻找幸福。可郑玉凡总是一笑了之，因为她知道公婆和女儿们都离不开她，她要替丈夫完成未尽的责任。邻居们都说：“遇到这样的媳妇是老陈家的福气啊。”郑玉凡总是挑公婆爱吃的口味去做饭菜，衣服、被褥脏了从不让老人自己洗，可每每家里遇到事情的时候，她都先征求公婆的意见。有时老人心情不好发脾气，她总是默默听着，等他们情绪稳定后，再和他们唠唠家常，哄老人开心。婆婆眼睛不好，很少出门，她就为婆婆买来收音机解闷；公公有高血压，她趁着手头宽裕的时候买了一个血压计，天天都帮他量血压。时光荏苒，郑玉凡两个女儿一天天长大，母亲的一言一行，深深印刻在她们幼小的心里。在母亲的言传身教下，两个孩子也都特别孝顺爷爷奶奶。郑玉凡的孝举在盘锦当地传为佳话，成为大家学习的榜样，乡亲们被她的默默付出感动，亲切地称她为“最美儿媳”。可她总是淡然地说：“我所做的一切，都没什么了不起，不过是给女儿们做个好榜样。”	谁孝老爱亲？	21	郑玉凡。
·2015年7月助人为乐2006年，时任民权县人武部副部长的李瑛，到野岗乡孟汽坊村住村帮建。有一天，他和乡亲们座谈时，看见一个浑身脏兮兮的孩子，经询问老乡得知，这是一名孤儿，叫王志良，父母离世不久，家里没有其他亲人投靠，辍学后四处流浪。得知情况后，李瑛当即决定帮助这个孤儿。第二天，李瑛就找到了王志良，帮他修整新家，一点一滴教他独立生活，还悄悄垫付学费协调他返校复学。后来，王志良从一所职业学院毕业，体检、政审合格后被李瑛送入军营。住村期间，李瑛先后认领4名孤儿，帮其中2人治好了皮肤病。这些年，李瑛认领的孤儿相继成人，谁到了服兵役的年龄，他就动员谁报名参军，还帮他们解除后顾之忧。李瑛及时建立孤儿战士家庭信息档案，每当庄稼收种和自然灾害来临时，他都会带领民兵服务队巡回提供服务，先后为13名孤儿战士协调军属低保，为6户人家整修房屋，为4户老人打了水井。李瑛与他送去当兵的21名孤儿战士有一个温暖约定，“要想报恩，就把训练场上的奖牌给我拿回来”。3年前，张太平入伍来到福建某海岛。他从小体质弱，训练成绩上不去，心理压力大。有一次，李瑛打电话关心鼓励张太平时，听出他的思想波动。李瑛就教育他，越是艰苦环境越能锻炼人、成就人，帮他正确认识成长中的困惑。他很快成为训练场的“小老虎”，年底被连队评为优秀士兵。2012年，从城关镇入伍的孤儿常明真，来到南京军区某师炮兵团。2014年3月，连队选拔骨干参加夏季军事大比武，常明真成绩不理想，一度思想消沉。李瑛得知后，开导他学会面对挫折，越挫越勇，靠过硬本领争取参赛机会。常明真知耻后勇，奋起直追。很快，他的五公里越野全连跑第一，轻武器射击发发命中，在比武中夺得两个单项第一的好成绩。（河南省文明办供稿）小传：李瑛，1969年生，河南省商丘市柘城县人，商丘市民权县人民武装部政委。9年来先后认领帮扶27名孤儿。	如何评价李瑛？	43	他是一个助人为乐的人。
男子投海自尽遇退潮陷淤泥 武警费半个小时拔出他原标题：男子投海自尽遇退潮陷淤泥 武警“拔”出了他广州日报5月4日消息，男子黄某来到深圳湾公园，心灰意冷地往海里走。不想，退潮了，水没了，却被困在没腰的淤泥里！这是发生在5月3日凌晨的一幕险情。幸运的是，武警广东省总队执勤第三支队的哨兵巡逻到这里，10多名兵哥费了半个多小时，终于把他从淤泥里“拔”起！“救命，救命，救命呀……”5月3日凌晨1时33分，武警广东省总队执勤第三支队四中队哨兵黄育宁、张振林在深圳湾公园巡逻时听到有人求救。哨兵打着手电寻声望去，只见距离岸边有50多米的海里有个泥人在晃动，声嘶力竭。在哨兵向中队报告后，中队指导员王发习带领应急小组10余人来到现场展开救援。 王发习熟悉深圳湾海边的情况，退潮后的淤泥深浅不一， “跟沼泽地一个样”，直接下海救人非但没把握，还是鲁莽行为。在观察现场情况、科学研判安全指数后，他指挥战士通过抛投救生圈与进行救援。“真是个挑战！”据参与救援的官兵介绍，距离岸边50多米，而且下着雨，可视条件差，抛的还是救生圈与绳子，与战士平时训练的投弹训练大有不同。经过十多次抛投，训练标兵林道富精准地将救生圈投送到了被困男子身边。经过半个多小时的努力，官兵们于凌晨2时10分终将被困男子安全救出。随后，官兵将男子带回营区，为其清洗淤泥，并提供了一身干净的衣服；还端上了一碗热腾腾的鸡蛋面。经过谈心疏导，男子最终解开了心结，放弃轻生念头。原来，该男子现年37岁，有两个小孩，在深圳某银行工作。因投资失败且与妻子就住房问题发生矛盾于去年离异，受经济与生活压力所迫，男子遂产生轻生念头，于5月3日凌晨1时左右往海里走。不料，水退潮了，而他也被淤泥、海风、雨滴给冻醒了，正要放弃轻生念头往回走；结果又涨潮了，他却又被困在了海里。正当他又一次绝望时，幸得官兵及时赶到，全力将其救出。 来源：广州日报责任编辑：吴金明	文中官兵武警做了什么好事？	11	将想要自尽男子从淤泥中救出。
孝老爱亲2016年10月致敬词2010年8月，王洋毕业后就职于长春市绿园区至爱老年医疗护理院，当上一名令人羡慕的“白衣天使”。2012年8月，吉林大学医院转来使用呼吸机的植物人，可是呼吸机从来没有接触过。呼吸机说明书都是英文，没人读得懂。王洋自告奋勇接下了这个任务，仅用一个晚上把说明书翻译出来了，连夜调试成功。在王洋护理下，老人生命体征恢复正常了，老人能用眼睛和人交流了。2013年的一天夜里，王洋查房，发现一位老人吊在卫生间里，她立马叫人把老人解救下来，就地心肺复苏抢救，老人逐渐恢复了意识。王洋怕老人再出意外，每夜陪在老人床前，和老人聊天。这件事情的发生让王洋感慨颇深，老人除了生活上的关怀更需要心理上的慰藉，如今老人的脸上露出了笑容，有了生活的信心。2014年，王洋还参加了吉林省两部地方行业标准《养老机构养护服务规范》和《养老机构心理支持服务规范》的编写工作，圆满完成任务，通过了专家评审和论证，填补了吉林省的行业空白。6年来，王洋先后护理过贫困老人、残疾老人、智障老人、社会救助等100多人，温馨送走了谢世老人30多人。王洋先后荣获吉林省“爱心护理员”、长春市“草根雷锋演讲”金牌；多次被评为院里先进工作者、优秀护士、四星级护理能手、“美丽的白衣天使”。	王洋做了哪些好事？	12	他和老人聊天、帮助残障老人、认真护理老人。
消防员趴引擎盖上吃泡面 怕弄脏私家车反复擦车title: '视频：消防员趴引擎盖上吃泡面 担心弄脏车走时反复擦拭',//标题source: '',//视频发布来源。如：新华网。});原标题：消防员趴引擎盖上吃泡面 怕弄脏私家车反复擦车最近，一则“消防员趴在轿车引擎盖上吃泡面”的视频引发网友关注。视频中，一名消防员处理完一起火警后，趴在小区内一轿车引擎盖上吃泡面充饥，吃完后，怕把私家车弄脏，用衣服擦引擎盖。据了解，6月18日，西安枫林路消防中队消防员从早上10多出警后，一直到下午4点多都没有吃饭，班长到超市买泡面给大家充饥。因为消防车坐不下，该消防员就在旁边一私家车引擎盖上吃饭。私家车主发现行车记录仪拍下的视频，便发给消防中队。消防员吃泡面充饥的画面让不少网友直呼心疼：“干着最危险的工作，吃的最没营养的东西，却有一颗最强大的心。”大家纷纷为消防员们点赞：“这是我们最值得尊敬的人。”、“我们之所以能安稳生活，是有人在替我们负重前行，珍惜、感恩、知足，”、“辛苦了！世界因你们而更美好！”来源：西安消防责任编辑：赵明	文中所有行为中最令人感动的是？	13	一消防员趴引擎盖上吃泡面，怕弄脏私家车反复擦车。
美国82岁老人偷价值280万珠宝 面临最高15年监禁原标题：美82岁老人偷价值280万珠宝 或面临最高15年监禁纽约警方称塞缪尔·萨巴蒂诺面临入室盗窃和重大盗窃罪的指控。（图源：CNN）海外网9月9日电 近日，美国纽约警方破获一起重大入室盗窃案，而这起案件的嫌犯是一名82岁的老人。警方称，他趁保安不注意潜入纽约的高级公寓，并挑选无人的公寓实施盗窃。在过去5年内，他至少犯下10起入室盗窃案，共偷走价值280万元的珠宝等贵重物品。据CNN报道，这名高龄嫌犯名叫塞缪尔·萨巴蒂诺，曾于2001年在其他盗窃案中被起诉。就在今年，他从三间高档公寓里盗走了价值约70万元的财物。犯案时，他通常携带一个黑色的包潜入纽约曼哈顿上东区的高档公寓楼，并前往公寓楼顶层，通过门口的报纸和包裹判断出无人居住的公寓，并潜入公寓盗窃手表、戒指、钻石和黄金首饰等贵重物品。纽约警方表示，自2014年来，他们一直在调查这一系列入室盗窃案，还曾在2015年公开发布监控录像以寻找犯罪嫌疑人。近日，他们终于追踪到嫌犯从佛罗里达州开往纽约的车辆踪迹，并将其逮捕。据悉，如果盗窃罪名成立，嫌犯将面临最高15年监禁。（海外网-美国-乔珊珊/实习编译 郭颖）责任编辑：张玉	文中的82岁老人塞缪尔·萨巴蒂诺的哪些行为事恶劣的？	12	趁保安不注意潜入纽约的高级公寓，并挑选无人的公寓实施盗窃。在过去5年内，他至少犯下10起入室盗窃案，共偷走价值280万元的珠宝等贵重物品。
媒体评男子越轨被夹身亡:遵守规则也是自我保护同情逝者，但不必讳认其悲剧的“自为性”；汲取教训，但没必要以键盘侠心态将自身从“不守规则者”中抽离。如果说男子越轨被夹身亡的悲剧有何公共价值，那最大的价值就是告诉我们：有时候，遵守规则，也是一种自我保护；有规则意识，不只是对社会更是对自己负责。文/佘宗明悲剧，总是来得那么不经意。26日下午，微博上有网友爆料称，D3026次列车抵达南京南站后，因有人坠落轨道而被迫停止运行1个多小时。同时，一段“男子卡在站台与列车”之间的视频在网上流传。视频显示，男子腿部卷入列车和站台的缝隙，上半身露在站台外表情痛苦。救援过程中，男子失去了生命体征。当天，南京火车站、京沪高铁南京南站官微都对此进行了回应，因男子翻越站台未果，被夹在车厢与站台之间，致悲剧发生。有些痛，隔着屏幕就能感知得到。@医生妈妈欧茜就写道，“南京南站那名越轨被夹身亡的男子太惨了，以至不忍转视频。传历史上有人被腰斩，疼痛不堪之际，沾自己的血连写七个‘惨’字。南京这一位，从出事到死亡，大概有两个小时，足足可以写七百个惨字，比腰斩还惨很多很多倍。”这只是推想，未必确切。可千钧重物压腿和在局促缝隙里无法动弹的痛感之剧烈，恐怕不逊于锥心刺骨。更何况，压顶的还有生命倒计时读秒带来的绝望。这种无法被表达的痛，也为这起悲剧中的“悲”字加粗。有些悲剧尚能挽回，有些悲剧则是万劫难复。男子越轨被夹身亡，悲就悲在，其结局难以挽回，其动机又很“无意识”，二者形成了剧烈反差：综合目前各方面信息看，他穿越站台，只是为了“抄近路”赶时间，可就是这份不守规则的轻率，撞上了最坏的结果：他没抄上近路，却踏上了死路。正所谓“死亡，即是无回应之地”，死是施于一个人的“极刑”。当事男子已为不守规则，付出了最为沉重的代价，就像那位翻墙入宁波动物园却被老虎咬死的男子。他们固然有过失，可其付出的生命代价，已超出其过失所应承受的代价阈值——虽然这是其逾矩时就注定了的，可他们终归是不幸的。再对其祭出“咎由自取”不作就不会死”之类的冷血之言，是残忍的，缺乏对逝者的尊重，也可能变成对其家人的二次伤害。责难未免残忍，但寓于悲剧个案中的警示价值，仍值得思忖。任何他人“亡羊”的教训，都是对自己“补牢”的警醒——太多时候，我们只看到罔顾规则的好处，却忘了规则被漠视背后的风险；只知道在悲剧酿成后惋惜，却在悲剧酿成前不以为意。其结果就是，没准在某个时点，我们就为过失付出了压根就不值得，又太昂贵的成本。现实中，像穿越轨道之类的不守规则行为，其风险或许就在“0”和“100”两个风险值临界点间滑移：没摊上就啥事没有，摊上了可能就是死或伤。而这起悲剧中的男子，刚好就摊上了后一种。这也给我们敲了警钟：我们对违反规则代价的认知，当如墨菲定律说的“事情若有变坏的可能，不管可能性多小，它总会发生”，要意识到代价的必然性，而不是习惯看到具体后果的随机性。同情逝者，但不必讳认其悲剧的“自为性”；汲取教训，但没必要以键盘侠心态将自身从“不守规则者”中抽离。如果说男子越轨被夹身亡的悲剧有何公共价值，那最大的价值就是告诉我们：有时候，遵守规则，也是一种自我保护；有规则意识，不只是对社会更是对自己负责。责任编辑：吴颜	文中男子在哪里翻越是危险的？	31	在站台翻越。
